[
  {
    "claimId": "maoist-china-claim-001",
    "caseId": "maoist-china",
    "claim": "Maoist political language structured individual life and death as meaningful only through service to 'the people' as an eternal collective body, inverting private survival as the supreme value and demanding selfless self-abnegation — including willingness to die — as the highest moral obligation.",
    "derivedFrom": [
      "maoist-china-passage-001",
      "maoist-china-passage-002"
    ],
    "createdBy": "human",
    "reviewedBy": "andrew-hammer",
    "reviewStatus": "argument-review",
    "publicationStatus": "draft",
    "confidence": {
      "value": 0.72,
      "label": "moderate-high",
      "rationale": "Both passages are from Mao's Selected Works (public domain, verified via Marxists.org). 'Serve the People' explicitly codes death-for-the-people as weightier than personal survival. 'In Memory of Bethune' codes absolute selflessness as the highest virtue. Together they establish the collective-immortality-to-sacrifice mechanism at the level of the sacred political order's core texts. Confidence capped pending broader periodization review.",
      "uncertaintyFactors": [
        "chain-requires-expansion",
        "periodization-ambiguity"
      ]
    }
  }
]
