[
  {
    "claimId": "postwar-germany-claim-001",
    "caseId": "postwar-germany",
    "claim": "The Grundgesetz placed human dignity beyond political revision, embedding a constitutional limit on collective-body claims as the structural foundation of the postwar German symbolic order.",
    "derivedFrom": [
      "postwar-germany-passage-001",
      "postwar-germany-passage-002"
    ],
    "createdBy": "human",
    "reviewedBy": "andrew-hammer",
    "reviewStatus": "argument-review",
    "publicationStatus": "draft",
    "confidence": {
      "value": 0.76,
      "label": "moderate-high",
      "rationale": "Both Grundgesetz passages advanced to evidence-review after text confirmation against the official Bundestag English translation at gesetze-im-internet.de. Art. 1(1) confirmed verbatim; Art. 79(3) text corrected ('on principle' → 'in principle'). Confidence raised from 0.72 reflecting confirmed passage integrity. Capped pending chain expansion and secondary-source corroboration.",
      "uncertaintyFactors": [
        "chain-requires-expansion",
        "single-source"
      ]
    }
  }
]
