[
  {
    "claimId": "united-states-after-vietnam-claim-001",
    "caseId": "united-states-after-vietnam",
    "claim": "The US symbolic order responded to the Vietnam defeat through institutional correction mechanisms and public acknowledgment of national crisis, demonstrating restrained reordering rather than sacrificial escalation: the War Powers Resolution attempted to embed congressional oversight of military commitments, while Carter named a national confidence crisis without calling for sacrifice.",
    "derivedFrom": [
      "united-states-after-vietnam-passage-001",
      "united-states-after-vietnam-passage-002"
    ],
    "createdBy": "human",
    "reviewedBy": "andrew-hammer",
    "reviewStatus": "argument-review",
    "publicationStatus": "draft",
    "confidence": {
      "value": 0.65,
      "label": "moderate",
      "rationale": "The War Powers Resolution and Carter speech directly support a restrained-reordering reading, but the subsequent Reagan-era effort to overcome the Vietnam syndrome complicates the interpretation. Confidence capped pending chain expansion.",
      "uncertaintyFactors": [
        "passage-text-pending-source-verification",
        "chain-requires-expansion",
        "periodization-contested"
      ]
    }
  }
]